{
  "schema_version": "action-approval-validation.v1",
  "validation_id": "validation-d57efbd94539cd086dfe836cd54c089c74debd43d1d00fbfb8a4cd12d31d53c3",
  "plan_ref": "plan-git-pull-ff-only-2026-05-23-001",
  "approval_ref": "approval-2026-05-23-git-pull-ff-only-approved-001",
  "action": "git-pull-ff-only",
  "checked_at": "2026-05-23T12:00:00Z",
  "binding_state": "binding_valid",
  "blocked_because": [],
  "source_refs": [],
  "boundary": {
    "does_not_execute": true,
    "does_not_mutate": true,
    "does_not_authorise_execution": true,
    "does_not_create_runner": true
  }
}
